{
  "schema_version": "sys4ai.plan-provider-intent.v2",
  "intent_id": "PPI-EXAMPLE-V2-001",
  "plan_id": "PLAN-EXAMPLE-001",
  "plan_sha256": "aaaaaaaaaaaaaaaaaaaaaaaaaaaaaaaaaaaaaaaaaaaaaaaaaaaaaaaaaaaaaaaa",
  "task_id": "TASK-002",
  "task_sha256": "2222222222222222222222222222222222222222222222222222222222222222",
  "generation": 2,
  "provider_id": "codex-app-server",
  "idempotency_key": "PLAN-EXAMPLE-001:2",
  "handoff_token_sha256": "1212121212121212121212121212121212121212121212121212121212121212",
  "predecessor_thread_id": "EXAMPLE-THREAD-001",
  "expected_revision": 8,
  "repository_fingerprint": "1313131313131313131313131313131313131313131313131313131313131313",
  "execution_profile_sha256": "8bc708f544d808af424aa969ac0799935c50cdfe4e9f2f146af0c62ee7c9637a",
  "requested_reasoning_effort": "max",
  "effective_reasoning_effort": null,
  "profile_verification_status": "not_verified",
  "profile_evidence_ref": null,
  "environment_mode": "reuse_bound_checkout",
  "repository_binding_sha256": "0416fdd9a56ccfc815feb622251d83993fd525434c3a32999bd43c61527c0527",
  "observed_topology_sha256": null,
  "same_thread_profile_repair": {
    "attempted": false,
    "thread_id": null,
    "evidence_ref": null
  },
  "created_at": "2026-07-19T00:01:00Z",
  "status": "intent",
  "provider_create_budget": 1,
  "create_attempts": 0,
  "returned_thread_id": null,
  "provider_response_sha256": null,
  "conflicting_thread_ids": [],
  "retry_authorized": false,
  "recovery": {
    "status": "not_required",
    "reason": null,
    "evidence_refs": []
  },
  "prior_journal_sha256": "1414141414141414141414141414141414141414141414141414141414141414",
  "hash_basis": "canonical_json_without_intent_content_sha256",
  "intent_content_sha256": "eeaf2518496957552d4f0d99f483e9a4de6f8fb6b3041bb08e4b1d7460f8f070",
  "finalized": false,
  "extensions": {}
}
